id,article_id,date,message,likes,dislikes,user_id,user_name,user_username,user_location,user_reputation,scraped_date
3085825376,65578230,2017-01-06T13:37:57+00:00,"To, že je Sobotka nedůvěryhodný (a samozřejmě je, velmi) neznamená automaticky, že je Babiš důvěryhodný. Hlavně by si měl vybrat - on neustále mluví o snižování daní, ale přitom sedí ve vládě, která daně zvyšuje, administrativní a buzerační zátěž.",0,0,114994996,Josef Pavlica,Basstard63,,1.628987,2017-01-11T04:09:49.994417+00:00
3085813435,65578230,2017-01-06T13:27:55+00:00,když chce ten slovák něco dobrého udělat tak ať těm svým naivním voličům rozdá svoje peníze a zmizí odsud!,1,0,97753669,Rosta Strzinek,rostastrzinek,,3.01258,2017-01-11T04:09:49.994417+00:00
3085799791,65578230,2017-01-06T13:16:55+00:00,"Přesně, protože takový Sobotka s jeho kmotrem Pokorným, který se stará o zájmy Bakaly, PPF, Čínanů a dalších oligarchů to s námi myslí určitě dobře. Proto zařízl kupříkladu policii, aby mu náhodou neškodili v práci pro pracující lid.

Babiš má aspoň tu slušnost jít do politiky sám na rozdíl od loutek Kalouska, Sobotky, Fialy.",0,0,52978745,PEPA z hospody,pepa_pepa,,2.869803,2017-01-11T04:09:49.994417+00:00
3085794122,65578230,2017-01-06T13:11:59+00:00,za ty neveris nicemu a nikomu a volit vubec nechodis,0,0,100091398,hotovson,hotovson,,2.6371320000000003,2017-01-11T04:09:49.994417+00:00
3085792626,65578230,2017-01-06T13:10:38+00:00,"Hlavně, že jsme věřili dobré úmysly Klausovi. Rozbil republiku, a rozkradl/nechal rozkrást co zmohl.",1,0,214268839,miroslavpaloucek,miroslavpaloucek,,1.3216459999999999,2017-01-11T04:09:49.994417+00:00
3085791130,65578230,2017-01-06T13:09:20+00:00,"Možná jsem trouba, ale mám problém mu nevěřit. Minule můj hlas neměl, teď už ale váhám. Sobotka je mluvka, Hašek ještě hůř. Politici z pravice (kterou jsem vždy volil) se ukázali jako korupčníci a gauneři a nemám pocit, že by se to změnilo. Ach jo. Já mu nakonec asi fakt sednu na lep.",0,0,214268839,miroslavpaloucek,miroslavpaloucek,,1.3216459999999999,2017-01-11T04:09:49.994417+00:00
3085789965,65578230,2017-01-06T13:08:16+00:00,To i Gottwaldovi či Stalinovi věřilo spousta naivků a věří v jejich dobré úmysly dodnes  :-),1,0,123756940,Ik,Ik_Eu,Praha,2.114872,2017-01-11T04:09:49.994417+00:00
3085787502,65578230,2017-01-06T13:06:00+00:00,"Sichtarová? To myslíte vážně? To jsem si myslel, že máte na víc.",3,0,52978745,PEPA z hospody,pepa_pepa,,2.869803,2017-01-11T04:09:49.994417+00:00
3085763908,65578230,2017-01-06T12:44:38+00:00,http://sichtarova.blog.idnes.cz/blog.aspx?c=578752,1,0,124526089,JDoe,JDoe00,,3.983499,2017-01-11T04:09:49.994417+00:00
3085759989,65578230,2017-01-06T12:40:45+00:00,"Za těch 52 mld může ČNB, díky které přiteklo při oslabené koruně zhruba 2 Kč na Euro opticky víc Kč, tedy o to byl vyšší příjem do státní kasy.Kdyby náš export byl nižší než import, tak ta ""Burešova zásluha"" bude spíš záporná.",0,0,139258195,David [H],disqus_uKhjDyWUOI,,2.640764,2017-01-11T04:09:49.994417+00:00
3085754586,65578230,2017-01-06T12:35:09+00:00,"132 - 80 = 52 mld. Kč. To je ta Babišova zásluha, voe.",0,0,48481682,julim,disqus_gHkdX6vYxc,,2.1455140000000004,2017-01-11T04:09:49.994417+00:00
3085753224,65578230,2017-01-06T12:33:47+00:00,"Docela rozumné názory, já mu věřím. Lidé co už se jim blíží konec jejich životní dráhy náhle pociťují touhu něco pro druhé udělat. Jde jen o to, aby takoví Sobotkové či Kalousci mu to moc neznechutili.",0,1,48481682,julim,disqus_gHkdX6vYxc,,2.1455140000000004,2017-01-11T04:09:49.994417+00:00
3085738838,65578230,2017-01-06T12:19:48+00:00,S tím dělením to záleží jestli je ve smlouvě čistá hrubá nebo superhrubá mzda!,0,0,237031485,Kecy01,kecy01,,1.247792,2017-01-11T04:09:49.994417+00:00
3085732756,65578230,2017-01-06T12:13:29+00:00,"hovori za vse:

HN: Byl loňský přebytek jen jednorázovou výjimkou, nebo budete chtít, aby Česko podobný výsledek zopakovalo i v dalších letech?

Tento rok bude těžký, protože dostaneme o 80 miliard korun z EU méně.

To se samozřejmě v plnění projeví.


tak, jak se uz ledaskde psalo, zadna zasluha ministra, ale proste nahoda, kdy se sesel neplanovany vynos z fondu EU s nizkou hodnotou investic za ne.",1,0,124526089,JDoe,JDoe00,,3.983499,2017-01-11T04:09:49.994417+00:00
3087508180,65578210,2017-01-07T13:33:09+00:00,"Soudružka Romancová. její muž soudruh Romancov a jejich dcera Ingrid Romancová Vám vy svoloči ještě ukáží co je to pravda. Za Vaše prachy, samozřejmě. Tihle paraziti díky vytváření nepřítele nebudou nikdy pracovat rukama.",0,0,237821798,Anštajn,antajn,,1.2471219999999998,2017-01-11T04:09:49.994417+00:00
3086377572,65578210,2017-01-06T19:00:55+00:00,To je jednoduché. Úroveň ekonomiky a kvality života do značné míry určuje kultura. A ta se v příštích 50 letech v západní Evropě změní mnohem drastičtěji než za posledních 500 let.,0,0,54992728,Jiří Hradecký,ohlolol,,1.5760329999999998,2017-01-11T04:09:49.994417+00:00
3086324376,65578210,2017-01-06T18:29:08+00:00,"Mylite se, nejde o zakaz, ale o informaci, ze fakta jsou jina.",0,0,172965592,Aranka Homfeld,arankahomfeld,,2.435371,2017-01-11T04:09:49.994417+00:00
3086251930,65578210,2017-01-06T17:44:56+00:00,Obhajujete cenzuru za statni peníze. Hnus. ,0,0,139219129,Petr Hanák,PetrHanak76,Praha,1.391913,2017-01-11T04:09:49.994417+00:00
3086179296,65578210,2017-01-06T17:06:12+00:00,"Já bych se nedůvěry neobával. Lidé už mají zkušenost z minula. Prostě co bude označeno za dezinformaci, to je bude zajímat a bude to doporučení.",2,0,97038181,Jaroslav Holeček,jaroslavholeek,,1.307018,2017-01-11T04:09:49.994417+00:00
3085837315,65578210,2017-01-06T13:47:43+00:00,"s nacismem se nebojuje osvětou. Kdyby osvěta byla účinná, druhou světovou válku bychom nikdy neměli",0,0,40387418,Jindrich Zapletal,jindrichzapletal,,1.921242,2017-01-11T04:09:49.994417+00:00
3085737756,65578210,2017-01-06T12:18:36+00:00,"rusko ze za poslednich 70 nebylo schopno priblizit ani standardu vychodni evropy, takze nevim co vas vede k presvedceni, ze to za 50 let bude jinak.",3,0,124526089,JDoe,JDoe00,,3.983499,2017-01-11T04:09:49.994417+00:00
3085735991,65578210,2017-01-06T12:17:01+00:00,"to by tak hralo, aby nekdo ze statnich penez zpochybnoval co rika zeman jenom jemu blizke ""zpravodajske"" servery...",0,1,124526089,JDoe,JDoe00,,3.983499,2017-01-11T04:09:49.994417+00:00
3085685382,65578210,2017-01-06T11:19:22+00:00,"zivotni uroven se da hodnotit ruzne a jiste se najdou regionalni rozdily, ale s tim ""podstatne horsi"" ponekud nesedi fakt je, ze napriklad prumerne stari aut ve Svedsku a Tatarstanu (oblast kolem Kazane) bylo pred par lety +- stejne",0,0,67217522,Tom Lebr,tomlebr,,1.2321389999999999,2017-01-11T04:09:49.994417+00:00
3085617398,65578210,2017-01-06T10:01:38+00:00,"PROBLÉM je v tom, že prostý lid a nejen on (většinou voličstvo prezidenta Zemana, komunistů a ČSSD) je ochotný a schopný věřit totálním hovadinám a v krajním případě na popud ""správných lídrů"" vzít do rukou i zbraně a začít s nimi páchat ""dobro"". Navíc byl tento lid nyní vyzván, aby se ozbrojoval.... Proti tomu asi tento úřad nepomůže, jako většina zbytečných úřadů, které kdyby nebyly, tak se nic nestane, ale za zkoušku to asi stojí.",0,1,118296196,Fik,Filipplive,,1.23586,2017-01-11T04:09:49.994417+00:00
3085599755,65578210,2017-01-06T09:41:58+00:00,"http://www.businessinsider.de/afd-muss-fake-news-ueber-clinton-loeschen-2016-12

http://www.zeit.de/digital/internet/2016-12/fake-news-facebook-catch-22",0,0,172965592,Aranka Homfeld,arankahomfeld,,2.435371,2017-01-11T04:09:49.994417+00:00
3085592909,65578210,2017-01-06T09:36:15+00:00,"Ono taky jak pro koho je ve Švédsku dobře. Přijmy nejchudších 10% celkem prudce klesají i ve Švédsku.

https://twitter.com/janzilinsky/status/816948291531374592?lang=cs",0,0,52978745,PEPA z hospody,pepa_pepa,,2.869803,2017-01-11T04:09:49.994417+00:00
3085591884,65578210,2017-01-06T09:34:43+00:00,"Proboha, je rozdíl mezi nelegálními posty v Německu a tzv. fake news.",0,0,52978745,PEPA z hospody,pepa_pepa,,2.869803,2017-01-11T04:09:49.994417+00:00
3085590892,65578210,2017-01-06T09:33:16+00:00,Ministerstva v době kampaně reagují na výroky opozičních kandidátů? Jste schopen to doložit?,1,0,52978745,PEPA z hospody,pepa_pepa,,2.869803,2017-01-11T04:09:49.994417+00:00
3085590539,65578210,2017-01-06T09:32:42+00:00,http://www.spiegel.de/netzwelt/web/facebook-neues-loesch-team-geht-gegen-hasskommentare-vor-a-1072175.html,0,0,172965592,Aranka Homfeld,arankahomfeld,,2.435371,2017-01-11T04:09:49.994417+00:00
3085590113,65578210,2017-01-06T09:32:00+00:00,"Že jsou dnes v Rusku životní podmínky podstatně horší než třeba ve Švédsku, je jistě pravda. Je však nanejvýš pravděpodobné, že nejpozději za 50 let to bude naopak. 
Problémem je, že Evropa takto strategické problémy řešit neumí, protože nejzazší horizont, na který dohlédne, je počátek příštího volebního období.
Samozřejmě je zde i faktor rostoucí muslimské populace v Rusku - její charakter se ale dost liší od muslimské populace v Evropě. Muslimská populace Ruska má kořeny na Kavkaze a ve Střední Asii a riziko spočívá spíše v nacionalismu a separatismu. Zatímco Evropská muslimská populace pochází z Blízkého Východu a Afriky a nejde o žádné separatisty, nýbrž kolonizátory. V Rusku to v horizontu jedné až dvou generací může vést k občanské válce. V Evropě to v průběhu jedné až dvou generací může vést k pozvolné islamizaci, která nebude probíhat formou válečného konfliktu - s výjimkou občasných izolovaných teroristických útoků - nýbrž plně demokraticky, ale jejím výsledkem bude kalifát kde nemuslimové budou žít v podobných podmínkách jako dnes v Iráku. Samozřejmě, s výjimkou elit, které v rámci svých ""integračních aktivit"" (organizace vybírání džizji, zajišťování dodávek plavovlasých panen do harémů kalífů apod.) budou mít určitá privilegia.",2,1,54992728,Jiří Hradecký,ohlolol,,1.5760329999999998,2017-01-11T04:09:49.994417+00:00
3085589638,65578210,2017-01-06T09:31:16+00:00,"Ano. Vědělo se to i tehdy. Navíc i podle Chilcota i tehdy CIA i MI6 upozorňovali, že invaze zvýší pravděpodobnost teroristických útoků na Západě a destabilizuje region.

Ostatně není problém si přečíst tzv. Podesta emails a najít si jak novináři a jiní experti např. na zdravotnictví přijímají pokyny od kapmpaně HRC a v některých případech záměrně píšou lživé články. Např. o návrzích zdravotní reformy B. Sanderse.

Lžete, facebook odmítl.
http://www.gq.com/story/facebook-fake-news-problem",1,0,52978745,PEPA z hospody,pepa_pepa,,2.869803,2017-01-11T04:09:49.994417+00:00
3085589329,65578210,2017-01-06T09:30:48+00:00,"Jako státní úředník plní své zadání: reagovat na dezinformace, které mohou vyostřit bezpečnostní situaci. Co to je ""zasáhnout do voleb""? V tom případě do voleb zasahují neustále všichni, to by ani žádné ministerstvo nemovlo v době předvolební kampaně vydat žádnou tiskovou zprávu ...",0,1,32281575,Pepa25,Pepa25,,2.586029,2017-01-11T04:09:49.994417+00:00
3085586100,65578210,2017-01-06T09:26:23+00:00,"A opravdu nekdo vedel v dobe invaze do Iraku, ze tam zadne chemicke zbrane nejsou? Nebo se to zjistilo, az bylo mozne se na miste o tom presvedcit?
Facebook neodmitl mazat fake news, a dohodl se a maze.
A jinak viz nahore, opravdu vas nekdo nuti cist stranky tohoto uradu? A nekoho nuti, zmenit nazor?",0,0,172965592,Aranka Homfeld,arankahomfeld,,2.435371,2017-01-11T04:09:49.994417+00:00
3085585829,65578210,2017-01-06T09:26:10+00:00,"Ano, takže přiznala, že jako státní úředník se cítí povinna v některých připadech zasáhnou do voleb.",1,0,52978745,PEPA z hospody,pepa_pepa,,2.869803,2017-01-11T04:09:49.994417+00:00
3085584273,65578210,2017-01-06T09:24:38+00:00,"Právěže pečlivě sleduju. Např. ""Centrum nebude zasahovat do voleb ..Moje vyjádření v DVTV reagovalo na dotaz moderátora, zda se bude CTHH vyjadřovat i k prohlášením v předvolební kampani. A odpověď zněla ano, ale pouze v závažném případě, kdy by např. někdo z kandidátů v rámci kampaně šířil dezinformaci, která by měla vysoký potenciál vyostřit bezpečnostní situaci (například by někdo z politiků šířil podobnou fámu, jako se objevila po Berlínském útoku na FB, že policie ví, že teroristé operují z našeho území a přijímá kvůli tomu opatření,). V takovém případě bude CTHH na jeho výrok reagovat a dodá potřebná fakta."" citace E. R., chat aktualne.cz dne 3.1.2017",0,1,32281575,Pepa25,Pepa25,,2.586029,2017-01-11T04:09:49.994417+00:00
3085577654,65578210,2017-01-06T09:18:45+00:00,"To myslíte vážně? Tak hloupá snad nejste? Pokud ano, tak si někde zjistěte co se psalo před invazí do Iráku.

Facebook naopak rázně odmítl mazat tzv. fake news jako zasahování do svobody slova.

Ale chápu to tak, že odpověd na moji otázku je : v žádné demokratické zemi na Západě podobný úřad neexistuje. Děkuji.",0,0,52978745,PEPA z hospody,pepa_pepa,,2.869803,2017-01-11T04:09:49.994417+00:00
3085576046,65578210,2017-01-06T09:16:19+00:00,"Na zapade si noviny, nebo televize zpravy overi, nez je vytisknou. A pak se taky dozvite, ze to, co nekdo napsal, neni pravda. Viz cele pobourene Rusko, kvuli udajnemu unosu ruske divky v Berline pred rokem. A co dohoda s Facebookem o mazani nepravdivych zprav? To i zde proslo tiskem.",0,0,172965592,Aranka Homfeld,arankahomfeld,,2.435371,2017-01-11T04:09:49.994417+00:00
3085572464,65578210,2017-01-06T09:12:29+00:00,Takže na jednoduchou otázku neodpovíte. Typické.,0,0,52978745,PEPA z hospody,pepa_pepa,,2.869803,2017-01-11T04:09:49.994417+00:00
3085571809,65578210,2017-01-06T09:11:32+00:00,"Je divne, ze tady kazdy druhy pise, jak se na zapade nesmi o nicem psat,
 ale kdyz je potreba obratit, tak uz je najednou zase vse jinak.",1,0,172965592,Aranka Homfeld,arankahomfeld,,2.435371,2017-01-11T04:09:49.994417+00:00
3085567377,65578210,2017-01-06T09:04:39+00:00,"Prosím pěkně, v které Západní demokracii funguje takový úřad, když tvrdíte, že ""tak to chodi v demokratickem svete"".",1,0,52978745,PEPA z hospody,pepa_pepa,,2.869803,2017-01-11T04:09:49.994417+00:00
3085567189,65578210,2017-01-06T09:04:21+00:00,"Jenže tohle je k ničemu kompletně.
I blbý prezident vyhlašuje volby nebo velí armádě. I tomu, kdo nemá auto, vozí po dálnici rohlíky.
Zajímalo by mne, jestli ten rozdíl opravdu nechápete, nebo jestli ho chápete, ale hájíte ty nesmysly z jiných příčin?",0,0,30123009,Antonin_Konecny,Antonin_Konecny,,3.253534,2017-01-11T04:09:49.994417+00:00
3085567117,65578210,2017-01-06T09:04:13+00:00,"tohle musí zemanoidům hooodně vadit
:))))))))))))))))))))))))))",1,1,97753669,Rosta Strzinek,rostastrzinek,,3.01258,2017-01-11T04:09:49.994417+00:00
3085565003,65578210,2017-01-06T09:02:00+00:00,"Babišovo stanovisko jen potvrzuje domněnky o tomto jakoby západním ""byznysmenovi"" s vážným podezřením na ruského rezidenta. Přestože se naoko staví kladně ke snahám zvýšit zbrojní výdaje ČR, jeho praktické kroky a postoje vedou k degradaci tohoto pozitivního úsilí.",0,1,148543963,Český Patriot,rhronza,,1.3490799999999998,2017-01-11T04:09:49.994417+00:00
3085558247,65578210,2017-01-06T08:55:23+00:00,"To je opravdu hrozne. Jini zase musi platit pana prezidenta a jeho uredniky. Dalsi pak dalnice, a nemaji auto. Atd. tak to chodi v demokratickem svete.",1,2,172965592,Aranka Homfeld,arankahomfeld,,2.435371,2017-01-11T04:09:49.994417+00:00
3085556419,65578210,2017-01-06T08:52:38+00:00,"Mně vadí, když to musím platit. Kdyby soudružka Romancovová vytvořila Kancelář pro nápravy dezinformací jako dědeček ze Saturnina, docela bych jí držel palec.",2,0,30123009,Antonin_Konecny,Antonin_Konecny,,3.253534,2017-01-11T04:09:49.994417+00:00
3085552626,65578210,2017-01-06T08:46:36+00:00,"Jestli pak začne paní Romancová taktéž zpětně zkoumat lži některých novinářů o válce v Iráku. Namátkou za vydavatlství Economia - Kundra, Spurný, Fischer.",3,0,52978745,PEPA z hospody,pepa_pepa,,2.869803,2017-01-11T04:09:49.994417+00:00
3085551381,65578210,2017-01-06T08:44:40+00:00,"Věčná škoda, že tento bohumilý úřad nebyl, když se nám v mediích lhalo o ukrajinském ""demokratickém"" Majdanu.",2,0,68031083,Vojtech Pánik,vojtechpnik,,1.530365,2017-01-11T04:09:49.994417+00:00
3085542453,65578210,2017-01-06T08:37:42+00:00,"Vy to musite cist? Ne. Vam ale vadi, kdyz jini zacnou pochybovat, ze?",2,2,172965592,Aranka Homfeld,arankahomfeld,,2.435371,2017-01-11T04:09:49.994417+00:00
3085537854,65578210,2017-01-06T08:30:15+00:00,"Ani jsem to slovo nenapsal, a už mám u příspěvku, k reakci na ten Váš, budíka.",0,0,220100121,Jiří Šedivý,ji_ediv,,1.5887149999999999,2017-01-11T04:09:49.994417+00:00
3085529067,65578210,2017-01-06T08:19:34+00:00,"A paní Romancové, neúspěšné političce za Stranu Zelených jde o co? Můžete jmenovat jednu jedinou Západní zemi, kde by něco takového fungovalo? Kde se státní úředník chystá zapojit do předvolební kampaně a určovat co je a co není pravda?",2,0,52978745,PEPA z hospody,pepa_pepa,,2.869803,2017-01-11T04:09:49.994417+00:00
3085527911,65578210,2017-01-06T08:17:42+00:00,"Tak si poslechněte soudružku Romancovou, která se chystá jako státní úředník zapojit do předvolební kampaně a štemplovat co řekli a co si myslí.",2,0,52978745,PEPA z hospody,pepa_pepa,,2.869803,2017-01-11T04:09:49.994417+00:00
3085527751,65578210,2017-01-06T08:17:27+00:00,"Potrefené husy se ozývají... Babis jehoz projekt je postaven ciste na politickem i klasickem marketingu veri v selsky rozum?

Zeman ktery vi presne kde kdo na svete (nedavno rekl ze vi  kdo za koho v Syrii bojuje a byl to naprosty blud) za co muze ma vyhrady, ze nekdo bude uvadet realna fakta?

Temhle lidem jde hlavne o moc a boji se, ze by volby mohli byt rozhodovany ne na zakalde jejich marketingovych planu",3,1,117180216,zdenek hejnák,zdenekhejnk,,1.379765,2017-01-11T04:09:49.994417+00:00
3085512698,65578210,2017-01-06T07:53:31+00:00,"Fanatismus vidím jen u těch, kdo šíří lži a straší lidi. Všichni normální lidé se rádi zapojí to očnačování lží a výmyslů. Já např. už asi 15 let sleduju web hoax.cz ...",0,1,32281575,Pepa25,Pepa25,,2.586029,2017-01-11T04:09:49.994417+00:00
3085511501,65578210,2017-01-06T07:51:39+00:00,"Hele, ty etniko, Amnesty má na webu petici na podporu Snowdena: https://www.amnesty.cz/maraton/ 
Vím, že je to pro tebe nepředstavitelné, ale jsou fakt nepolitičtí, resp. protestují proti porušování liddských práv, ať už je to v Americe nebo Rusku ...",0,2,32281575,Pepa25,Pepa25,,2.586029,2017-01-11T04:09:49.994417+00:00
3085479675,65578210,2017-01-06T07:03:31+00:00,"Už to z nich pomalu leze, z estébáků. Kromě Německa prý  ""spustila obří spolupráci v zápasu s dezinformacemi""  mj. i skupina ""lidskoprávních organizací"", včetně Amnesty International, která, jak všichni víme, rozšiřuje po světě lži a dezinformace o údajné ""diskriminaci"" jistého ""společensky vyloučeného"" etnika v ČR.",1,0,220100121,Jiří Šedivý,ji_ediv,,1.5887149999999999,2017-01-11T04:09:49.994417+00:00
3085458929,65578210,2017-01-06T06:32:22+00:00,Fanatičtí soudruzi honí pravdu a vytváří seznamy nepohodlných. Joe mccarthy má určitě radost. ,3,1,52978745,PEPA z hospody,pepa_pepa,,2.869803,2017-01-11T04:09:49.994417+00:00
3086277269,65578110,2017-01-06T17:59:47+00:00,"Na dětech se dají vydělat desítky či stovky korun, na státních zakázkách miliardy!",0,0,128875848,Kritik,disqus_BEcDwEsB9t,,1.41593,2017-01-11T04:09:49.994417+00:00
3085833536,65578110,2017-01-06T13:44:42+00:00,"pražská mafie, co čekat",0,0,70557787,TOMAS,disqus_cQYNYWrXFz,,1.5080799999999999,2017-01-11T04:09:49.994417+00:00
3085701665,65578110,2017-01-06T11:38:01+00:00,... je po něm Jime.,0,0,205269774,Arnie,disqus_h0or2Ogg1U,,1.2378,2017-01-11T04:09:49.994417+00:00
3085684568,65578110,2017-01-06T11:18:19+00:00,"Pohádka o tom, jak ""vlivný"" kolotočář (ČSSD) skrze své kamoše k velkému štěstí (ne)přišel?",0,0,131072217,McMillan,milan_cihl,Translyvánie,1.418316,2017-01-11T04:09:49.994417+00:00
3085684510,65578110,2017-01-06T11:18:14+00:00,"...ty správné kamoše. Podobně lukrativní byzyns může být podnikání v OZE. Nebo ve vodárenství, Tam taky penízky jen tak samy tečou. A když šetřivý občan přivře kohoutek, ejhle! - zvýší se ""náklady"" a tím i cena. A tak je to spravne a tak to ma byt...!",0,0,131072217,McMillan,milan_cihl,Translyvánie,1.418316,2017-01-11T04:09:49.994417+00:00
3085638092,65578110,2017-01-06T10:25:23+00:00,"Odpady patří mezi nejvýnosnější byznys, v podstatě nulové riziko, minimální odpovědnost, žádná konkurence, zisky mimořádné, takže zájem je obrovský a uchytí se tam jen ti, co ""na to mají"".",0,0,129898878,Martas,disqus_Y5yIBb4b8T,,1.322975,2017-01-11T04:09:49.994417+00:00
3085583696,65578110,2017-01-06T09:23:44+00:00,"mafiani a odpady. cim to je, ze to je tak rozsirene spojeni, at uz jde o neapol nebo o prahu?",0,0,124526089,JDoe,JDoe00,,3.983499,2017-01-11T04:09:49.994417+00:00
3085529657,65578110,2017-01-06T08:20:08+00:00,"to není podnikatel, to je kolotočář a informovaní ví, že i ma.....",0,0,117071872,Pavel Adamec,paveladamec,,1.4857989999999999,2017-01-11T04:09:49.994417+00:00
3085495917,65578110,2017-01-06T07:28:16+00:00,"Podmínky soutěže budou nastaveny pro tu správnou firmu, možná i křoví přidají.. tzv, český standard",0,0,104169140,Petr Tester,petrtester,,1.301475,2017-01-11T04:09:49.994417+00:00
3085473535,65578110,2017-01-06T06:53:46+00:00,Odírání dětí na poutích se opravdu vyplácelo .Nyní to asi tolik nenese .la Familia se musí uplatnit jako klasická firma .,0,0,181643533,schvede,schvede,,2.8378569999999996,2017-01-11T04:09:49.994417+00:00
3088893174,65577890,2017-01-08T12:01:44+00:00,"Já si chodím i pro léky na tlak v době chřipek k diabetologovi. Je to totiž na palici, když jsem si byl onehdy dvakrát (každý rok v prosinci) pro léky na tlak u ""obvoďáka"", tak jsem dostal léky na tlak a z čekárny jsem si odnesl ""prémii"" - chřipku. Ta se u diabetika léčí také hůře. A obráceně, když mám rýmu a horečku, tak se z pravidelné kontroly na diabetologii omluvím a když v té době potřebuji léky (už ale nedělám začátečnickou chybu - mám zásobu léků, abych takový případ překlenul), tak si pošlu pro ně syna, abych to tam mezi cukráři nerozšířil. Léky beru pravidelně, cukrovku mám tedy kompenzovanou a na kontrolu si chodím pro pochvalu, ale 8kg bych potřeboval někomu odevzdat, přenechám za odvoz tomu, kdo slíbí, že budou u něj v dobré péči a budou vzkvétat. Hlaste se v redakci. :)",0,0,123150899,Martin1,disqus_QRVpvgPYVN,,4.509473,2017-01-11T04:09:49.994417+00:00
3088865027,65577890,2017-01-08T11:21:02+00:00,Nebylo by kromě toho taky efektivní učit Čechy nesypat do sebe hory masa a hlavně nekvalitních tuků což je hlavní příčina většiny cukrovek?,0,0,81911731,Martin Poljak,martin_poljak,,2.8155650000000003,2017-01-11T04:09:49.994417+00:00
3088774077,65577890,2017-01-08T08:51:28+00:00,"Vše je dáno osobností lékaře. Kvalitní obvoďák může být lepší než špatný internista diabetolog a to platí i obráceně. Nedivím se, že diabetologové řvou, přišli by o kšeft a klienty a tedy o peníze. Jsem ovšem přesvědčen že běžnou čtvrtletní prevenci by zvládli obě skupiny stejně. Navíc cukrovku doprovází řada dalších problému, obvykle hypertenze. Takže každé čtvrtletí musíte navštívit nejen diabetologa ale i všeobecného lékaře, a pak ročně na vyšetření očí, ledvin, srdce,  žíl a třeba i ušního a pod. Pokud by všechna ta vyšetření zvládl obvoďák a byl za to pořádně zaplacen, hned by byl lékařů nadbytek a pojišťovna i dost ušetřila. Holt asi by byla potřebná Dr. Quinnová co by uměla i zuby trhat.",0,0,48481682,julim,disqus_gHkdX6vYxc,,2.1455140000000004,2017-01-11T04:09:49.994417+00:00
3087365587,65577720,2017-01-07T10:35:28+00:00,"Mít opravdu luxusní hotel, tak do toho nejdu. Přeci jen spojení ""hodinový hotel"" má velmi negativní konotaci a bál bych se, že mě to bude stát spoustu zákazníků.",0,0,155528096,Tetřev Honzlovec,tet_ev_honzlovec,,1.8786899999999997,2017-01-11T04:09:49.994417+00:00
3087259819,65577720,2017-01-07T07:39:49+00:00,40 euro za tři hodiny je jako někde jinde za dva dny...,0,0,85695578,Avathar Nabuchodonozor,avatharnabuchodonozor,,1.248648,2017-01-11T04:09:49.994417+00:00
3085569590,65578350,2017-01-06T09:08:09+00:00,"Myslíte, že vám osvětlení v místě, kde nikdo celou noc neprojde zvýší bezpečnost? Jen na vás bude útočník lépe vidět. ;-) A pokud mluvíte o tom, že můžete zakopnout... Tak noste v noci čelovku. Nikde se přeci nepíše, že musí být osvětlena všechna místa, kam se vydáte. ;-)",0,0,123998622,Libor Chocholatý,liborchocholat,,1.21655,2017-01-11T04:09:49.994417+00:00
