id,article_id,date,message,likes,dislikes,user_id,user_name,user_username,user_location,user_reputation,scraped_date
3082715129,65575520,2017-01-04T15:38:12+00:00,"Samozřejmě, že když ekonomika roste a tlak na pokles cen polevil, je třeba se zdržet aktivní podpory poptávky. To je přece jasné. Inflaci už máme, jestli sis nestihl všimnout.",0,0,130881407,Richard Fuld,richard_fuld,,3.5189070000000005,2017-01-11T04:09:49.994417+00:00
3082660500,65575520,2017-01-04T15:00:11+00:00,"Všechny manipulace s ekonomikou, ať už ""prospěšná"" stimulace během krize či ""rozumné"" brždění během bublinového růstu jsou v první řadě přáními těch, kteří se nechtějí nijak měnit a drží ekonomiku neustále v těch samých kolejích, často vysloveně k neprospěchu celku.

Daleko výhodnější pro celou společnost je přirozená flexibilita a schopnost jednotlivých subjektů se adaptovat na změněnou situaci. Jinak bude ekonomika zaplevelena těmi, co sice nějak dokáží přežít a dokonce třeba i čerpat dotace, ale celku budou jen škodit.",0,0,105942080,G94003,g94003,,3.42997,2017-01-11T04:09:49.994417+00:00
3082656124,65575520,2017-01-04T14:57:03+00:00,"Proboha, raději na nesmysl toho pána ihned zapomeňte.",0,0,105942080,G94003,g94003,,3.42997,2017-01-11T04:09:49.994417+00:00
3082653782,65575520,2017-01-04T14:55:20+00:00,"Tomu je marné cokoliv říkat, má načtené poučky, které si aplikuje podle toho, jak se mu to hodí.
Příjmů máme nejvíc v historii, přesto se plánují schodky. Ve zdravotnictví je nejvíc peněz v historii, přesto je v největší krizi a v důchodech nám zadělala na demontáž penzijního systému. Celá tato ""úspěšná vláda"" to řídí pi*** ke zdi.",0,0,107792219,Ladič,disqus_v3FtsMuP4f,,2.783324,2017-01-11T04:09:49.994417+00:00
3082651353,65575520,2017-01-04T14:53:34+00:00,"Aha, takže Kalouskovo škrtání investic ekonomiku totálně utopilo, ale najednou je velmi důležité neposilovat poptávku, protože bychom si vykoledovali zbytečně vysokou inflaci. Tu inflaci, kterou nemáme a po které ČNB tak silně touží by najednou byla nebezpečná? Čoveče z které učebnice jsi to zase vyčetl?",1,0,107792219,Ladič,disqus_v3FtsMuP4f,,2.783324,2017-01-11T04:09:49.994417+00:00
3082644995,65575520,2017-01-04T14:48:59+00:00,"Zjevně tedy nechápete o čem mluvím. Já mluvím o nadbytečných výdajích Babiše vzhledem ke Kalouskovi. 

Vás zajímá jen výše státního dluhu a nechápete, že s ním je možné různým způsobem manipulovat a oblbovat tak mentálně slabší příznivce ANO. 

A to, že Babiš prožral 150 miliard CZK rezerv, které tu na náklady navýšení státního dluhu pořídil ještě Kalousek, to je Vám úplně jedno.

Babiš má jen letos o 150 miliard CZK více příjmů než měl Kalousek v roce 2013. A deficit má být téměř stejný. Při prakticky nulové inflaci. To je zjevně naprosto špatná politika.",0,0,105942080,G94003,g94003,,3.42997,2017-01-11T04:09:49.994417+00:00
3082641176,65575520,2017-01-04T14:46:13+00:00,"Mají € - nakoupí koruny a za ty pak dluhopisy. Až koruna přitvrdí, zase nakoupí € a vydělají. Kdo prodělá, bude ČNB a potažmo my všichni.",1,0,133322085,venomak,venomak,"Praha, Jižní čechy",1.8693780000000002,2017-01-11T04:09:49.994417+00:00
3082620761,65575520,2017-01-04T14:30:45+00:00,"Všichni ekonomové dobře vědí, že strašení nám ublížilo daleko více, než škrtání investic a jak je vidět nyní, ekonomika jede i bez nich nebo snad ne? ",0,0,107792219,Ladič,disqus_v3FtsMuP4f,,2.783324,2017-01-11T04:09:49.994417+00:00
3082618458,65575520,2017-01-04T14:28:57+00:00,"Jak tvrdí geniální ekonom, věčně diskutující důchodce Richald Fuld, stát dluží v podstatě sám sobě, protože stát = občané.",0,0,107792219,Ladič,disqus_v3FtsMuP4f,,2.783324,2017-01-11T04:09:49.994417+00:00
3082615994,65575520,2017-01-04T14:27:02+00:00,"Samozřejmě, stát dluží sám sobě. Pamatuji si velmi dobře tvé velmi jednoduché, ale zcela nesmyslné řešení řeckého dluhu.",1,0,107792219,Ladič,disqus_v3FtsMuP4f,,2.783324,2017-01-11T04:09:49.994417+00:00
3082598473,65575520,2017-01-04T14:14:11+00:00,"Karel Marel není nejspíš excelentní v žádné oblasti, byť si to o sobě pravděpodobně myslí. :-)",1,0,130881407,Richard Fuld,richard_fuld,,3.5189070000000005,2017-01-11T04:09:49.994417+00:00
3082596529,65575520,2017-01-04T14:12:37+00:00,"představte si, že jo.. Každej nemůže být excelentní ve všech oblastech :)",0,0,73328744,Jarda Punčochář,mandalorian1306,,2.4268650000000003,2017-01-11T04:09:49.994417+00:00
3082595876,65575520,2017-01-04T14:12:07+00:00,Děkuji za informace :),0,0,73328744,Jarda Punčochář,mandalorian1306,,2.4268650000000003,2017-01-11T04:09:49.994417+00:00
3082595493,65575520,2017-01-04T14:11:50+00:00,"Díky za vysvětlení, tak nějak jsem si to myslel :)",0,0,73328744,Jarda Punčochář,mandalorian1306,,2.4268650000000003,2017-01-11T04:09:49.994417+00:00
3082594660,65575520,2017-01-04T14:11:09+00:00,"Saldo státního rozpočtu je ukazatel hospodaření státu, ne zdroj pro investice. Pokud ekonomika roste, je nízká nezaměstnanost a ceny mírně rostou, není nejmenší důvod do takového stavu zasahovat a přebytek by se měl použít neutrálně, tedy na splacení dané části státního dluhu. Né proto, že splácení státního dluhu je nezbytně nutné. To není. Důležité je ale neposilovat zbytečně státními výdaji poptávku, která se jeví být dostatečně silná (ceny a ekonomika rostou). Pokud začneme posilovat poptávku státními výdaji, vykoledujeme si akorát zbytečné přehřátí ekonomiky a zbytečně vysokou inflaci.",0,0,130881407,Richard Fuld,richard_fuld,,3.5189070000000005,2017-01-11T04:09:49.994417+00:00
3082586626,65575520,2017-01-04T14:04:42+00:00,To by mohlo dávat smysl.,0,0,130881407,Richard Fuld,richard_fuld,,3.5189070000000005,2017-01-11T04:09:49.994417+00:00
3082585612,65575520,2017-01-04T14:03:55+00:00,"KaloUsek má na hrbu násobně víc, než nějakých 100 miliard. A za současné vlády státní dluh KLESÁ!!! Pokud po této vládě něco zůstane, tak to bude NIŽŠÍ státní dluh!!!",0,0,130881407,Richard Fuld,richard_fuld,,3.5189070000000005,2017-01-11T04:09:49.994417+00:00
3082581239,65575520,2017-01-04T14:01:43+00:00,A proč si raději nenechají hotovost? Nemusí platit záporný úrok a na posílení koruny taky vydělají.,0,0,130881407,Richard Fuld,richard_fuld,,3.5189070000000005,2017-01-11T04:09:49.994417+00:00
3082579023,65575520,2017-01-04T13:59:55+00:00,":-) Vlevo je vpravo. Nahoře je dole. Kalousek neškrtil ekonomiku, to si lidi špatně vyložili. :-)",0,0,130881407,Richard Fuld,richard_fuld,,3.5189070000000005,2017-01-11T04:09:49.994417+00:00
3082576452,65575520,2017-01-04T13:57:47+00:00,"Jestli ta ekonomika nerostla právě proto, že zde frčela úvěrová expanze. :-)",0,0,130881407,Richard Fuld,richard_fuld,,3.5189070000000005,2017-01-11T04:09:49.994417+00:00
3082575307,65575520,2017-01-04T13:56:49+00:00,:-),0,0,130881407,Richard Fuld,richard_fuld,,3.5189070000000005,2017-01-11T04:09:49.994417+00:00
3082575112,65575520,2017-01-04T13:56:40+00:00,Není důvod splácet státní dluh. Splacení státního dluhu je čirý nesmysl.,1,0,130881407,Richard Fuld,richard_fuld,,3.5189070000000005,2017-01-11T04:09:49.994417+00:00
3082573562,65575520,2017-01-04T13:55:21+00:00,"Státní dluh je v podstatě pseudodluh. Stát dluží v podstatě sám sobě, pokud platí premisa, že stát = občané státu. Státní dluhopisy jsou jen jakýmsi potvrzením, že došlo k emisi peněz v objemu státního dluhu.",1,0,130881407,Richard Fuld,richard_fuld,,3.5189070000000005,2017-01-11T04:09:49.994417+00:00
3082571154,65575520,2017-01-04T13:53:26+00:00,A to máte právo volební?,0,0,123731190,Karel Marel,karelmarel,,2.15686,2017-01-11T04:09:49.994417+00:00
3082531711,65575520,2017-01-04T13:26:16+00:00,"Problém je ten, že Babiš investovat nechce, investice seškrtal na stejnou úroveň, jako byly v době krize.",0,0,107792219,Ladič,disqus_v3FtsMuP4f,,2.783324,2017-01-11T04:09:49.994417+00:00
3082452917,65575520,2017-01-04T12:10:16+00:00,"Ale já si nechci půjčovat! (odpověď i pro G94003). Já jen nechci z přebytku splácet dluh (snižovat zadluženost, která je přiměřená). Takže přirovnání s hypotékou nesedí, podle mě jsme spíš v situaci některých lidí, kteří si nyní zakládají 5leté TV, aby dostali 1,5% úrok (ano, i takoví zoufalci mezi námi jsou) - a přitom možná za 2 roky budou potřebovat úvěr za 10% ...",0,0,32281575,Pepa25,Pepa25,,2.586029,2017-01-11T04:09:49.994417+00:00
3082448753,65575520,2017-01-04T12:05:41+00:00,"zahraniční vlastníci počítají s jistým ziskem, zatímco naše penzijní fondy pláčou nad tím, že se jim investice do státních dluhopisů nezhodnocují.. beru to tak, že je to krátkodobá uměle vyvolaná záležitost",0,0,125155974,Jan Kotas,jankotas,Brno,1.383947,2017-01-11T04:09:49.994417+00:00
3082444578,65575520,2017-01-04T12:01:00+00:00,"Přípravu dálnic stopl Bárta. To šetření zas tak nesmyslné nebylo. Nesmyslné bylo, že to opozice takto prodávala lidem a tím zasekla spotřebu. Jen pár negativních slov stačí položit banku, nám strašení Kalouskem zaseklo celou ekonomiku. Btw. nyní ekonomika jede (díky investicím rozhodně ale ne) a přitom stavebnictví klesá, Agrofertu klesají tržby i při tom obrovském množství státních zakázek a dotací.",0,0,107792219,Ladič,disqus_v3FtsMuP4f,,2.783324,2017-01-11T04:09:49.994417+00:00
3082427060,65575520,2017-01-04T11:40:40+00:00,"Nenechte se ošálit krátkodobým fenoménem jakými jsou záporné úroky. Vy chcete po státu, aby se choval stejně nezodpovědně jako člověk, co si nyní vezme nejvyšší možnou hypotéku s nejvyšší splátkou, kterou je schopen měsíčně splácet, protože ty úroky jsou přece tak nízké (v některých zemích Evropy dokonce záporné). Jenže krátkodobý benefit může být zcela neutralizován dlouhodobým břemenem, které vznikne posléze, kdy budeme muset vydat na tyto staré dluhy nové dluhopisy. Splácet dluhy je možná z krátkodobého hlediska ekonomický nesmysl, ale z dlouhodobého na tom budeme profitovat všichni.",0,0,125155974,Jan Kotas,jankotas,Brno,1.383947,2017-01-11T04:09:49.994417+00:00
3082421885,65575520,2017-01-04T11:34:21+00:00,"Víte, proč někdo nakupuje dluhopisy se záporným úrokem? Není to z charity, jak si možná myslíte, ale z očekávání daleko vyššího zisku po předpokládané změně kurzu.",0,0,133322085,venomak,venomak,"Praha, Jižní čechy",1.8693780000000002,2017-01-11T04:09:49.994417+00:00
3082419973,65575520,2017-01-04T11:32:00+00:00,Dálnice stopnul Bárta.,0,0,133322085,venomak,venomak,"Praha, Jižní čechy",1.8693780000000002,2017-01-11T04:09:49.994417+00:00
3082410867,65575520,2017-01-04T11:20:37+00:00,"Když se podívám na většinu zemí světa, mají horší infrastrukturu než my. Máme jednu z nejhustějších železničních sítí, dálniční síť už taky začíná být slušně provázaná. Že se do infrastruktury bude investovat celé další století, nepochybuji, ale nedává mi to důvod se kvůli tomu více zadlužovat, než dokáže ekonomika pokrýt. Zeptejte se Američanů, co je nejvíc trápí. A kromě kriminality, stagnujících mezd pro střední třídu, to bude právě ""špatná infrastruktura"", a to mají jednu z nejlepších dálničních sítí na světě. Ono se asi nedá o žádné zemi říct, že má dobrou infrastrukturu, to hodnocení je totiž subjektivní.",0,0,125155974,Jan Kotas,jankotas,Brno,1.383947,2017-01-11T04:09:49.994417+00:00
3082396015,65575520,2017-01-04T11:01:31+00:00,"Podnikatelé po státu nic nechtějí, naopak stát pořád chce něco po nich!",0,0,237031485,Kecy01,kecy01,,1.247792,2017-01-11T04:09:49.994417+00:00
3082387709,65575520,2017-01-04T10:50:13+00:00,"Já být na jejich místě peníze bych investoval do ziskových věcí jako jsou cenné papíry, akcie atd.. Dát peníze na umoření státní ho dluhu totální blbost těmi penězi ho nepokrejou ani drobek. Spíše vyhozené peníze. A Zbytek ani nemluvím jako opravy dálnic atd.",0,0,237415593,Lukáš Kracík,lukkrack,,1.232124,2017-01-11T04:09:49.994417+00:00
3082375082,65575520,2017-01-04T10:33:05+00:00,"Dle mého investovat část do veřejné infrastruktury (ČOV, oprava stávající dopravní infrastruktury) a částí zaplatit vybrané nevýhodné dluhy ...",0,0,233807344,Mirek,disqus_Z214hq3cWA,,1.2409249999999998,2017-01-11T04:09:49.994417+00:00
3082374470,65575520,2017-01-04T10:32:16+00:00,"Co bychom podnikatelům vraceli???

Všichni chtějí více státního aparátu (2x větší armádu), atd., takže aby těch peněz nebylo příští rok málo.",0,0,124033019,economistor,economistor,,1.601893,2017-01-11T04:09:49.994417+00:00
3082368102,65575520,2017-01-04T10:23:38+00:00,"Aby za pár let představovaly splátky dluhu několikanásobně větší číslo než dnes, že ?

To, že dnes jsou úroky z českých dluhopisů záporné je nepodstatné. Podstatné je to, že ten nový dluh rozhodně nesplatíme během pár měsíců či let, ale v lepším případě během několika desetiletí. A tam ta zátěž bude daleko nepříjemnější než je dnes hloupý a nic moc nepřinášející pokus navyšovat růst pomocí dalšího zadlužování.",1,0,105942080,G94003,g94003,,3.42997,2017-01-11T04:09:49.994417+00:00
3082365279,65575520,2017-01-04T10:19:46+00:00,"Za dvacet let bude všem jedno, že kdysi byl ministrem financí nějaký Kalousek, který díky omezování deficitů mírně prohloubil ekonomickou stagnaci. 

Ale těch cca 100 miliard CZK dluhu navíc, co už má současná vláda na svědomí, bude zatěžovat i všechny budoucí generace.",0,0,105942080,G94003,g94003,,3.42997,2017-01-11T04:09:49.994417+00:00
3082362354,65575520,2017-01-04T10:15:32+00:00,"To jsou peníze těch subjektů, které koupily české dluhopisy. Tedy především české a zahraniční banky. 

A prostřednictvím těchto subjektů všichni, kdo mají v těchto bankách své úspory, důchodová spoření, investiční pojištění apod.",1,1,105942080,G94003,g94003,,3.42997,2017-01-11T04:09:49.994417+00:00
3082360728,65575520,2017-01-04T10:13:04+00:00,"Ten přebytek představuje investice, které nebyly zrealizovány a v dohledné době ani nemohou být realizovány (Babiš se vymlouvá na to, že nejsou připraveny - spíš tu někdo poslední 3 roky zaspal a v blaženém domnění, že nám EU všechny staré EIA schválí, nedělal vůbec nic).

A protože při minulých deficitech (snad kromě Kalouska) nikdo nezvyšoval daně, aby stát hospodařil vyrovnaně, tak ani dnes není žádný důvod, proč by mělo být s přebytkem naloženo obdobně.",0,0,105942080,G94003,g94003,,3.42997,2017-01-11T04:09:49.994417+00:00
3082353540,65575520,2017-01-04T10:03:15+00:00,Tak logické by bylo aby se ten přebytek vrátil do ekonomiky tedy vrátit to podnikatelům. Kteří ty daně přeplatili vlastně byli okradeni.,0,0,237031485,Kecy01,kecy01,,1.247792,2017-01-11T04:09:49.994417+00:00
3082346769,65575520,2017-01-04T09:53:24+00:00,Splácet dluh v období růstu rozhodně není ekonomický nesmysl.,2,0,137806887,Josef K,disqus_nb1DfWKX5V,,1.274751,2017-01-11T04:09:49.994417+00:00
3082344101,65575520,2017-01-04T09:49:40+00:00,"V ekonomice se moc nevyznám, ale co je to vlastně ten státní dluh? To dlužíme komu? Marťanům, Číňanům? A je to reálný množství peněz, nebo jenom papírová věc naoko (něco jako Chovancův 9ti měsíční titul)?",0,0,73328744,Jarda Punčochář,mandalorian1306,,2.4268650000000003,2017-01-11T04:09:49.994417+00:00
3082341643,65575520,2017-01-04T09:46:14+00:00,"Bohuše k peňezům nepouštějte,zase něco vymyslí s Bakalou.",3,0,97480345,jaro,disqus_carTp4cTrD,krnov,1.378615,2017-01-11T04:09:49.994417+00:00
3082322985,65575520,2017-01-04T09:22:15+00:00,az po Americanech :-),0,0,150209501,sasa sasa,disqus_Ik3GDySbkZ,,1.919435,2017-01-11T04:09:49.994417+00:00
3082313193,65575520,2017-01-04T09:16:24+00:00,"Většina ekonomů by spíše uvítala, kdyby vláda dala přebytkové peníze na investice. - A ten dluh budeme jako splácet kdy???",0,0,130940333,milda,disqus_TZDE6PRsE4,,1.299774,2017-01-11T04:09:49.994417+00:00
3082289572,65575520,2017-01-04T08:40:14+00:00,"Souhlas, rozhledny fakt ne :-) Proto se mi líbí ti Lidovci s čističkami ...",1,0,32281575,Pepa25,Pepa25,,2.586029,2017-01-11T04:09:49.994417+00:00
3082288923,65575520,2017-01-04T08:39:15+00:00,"Samozřejmě, je to otázka priorit. Pokud máme jeden z nejnizších dluhů (nižší má v EU snad jen Norsko, Švýcarsko a Lucembursko), ale špatnou infrastrukturu, tak jsou moje preference jasné ...",0,0,32281575,Pepa25,Pepa25,,2.586029,2017-01-11T04:09:49.994417+00:00
3082288899,65575520,2017-01-04T08:39:13+00:00,To jsou ale nesmyslný žvásty!,0,0,106192024,Sherlock Houmeles,antonintony,,10.170761,2017-01-11T04:09:49.994417+00:00
3082287189,65575520,2017-01-04T08:36:44+00:00,"než stavět rozhledny  a cyklostezky za stamiliony, radši neinvestovat s uhradit část dluhu",1,0,97313807,Maxx,disqus_9IfYcz5hXX,Stínadla,3.418239,2017-01-11T04:09:49.994417+00:00
3082284432,65575520,2017-01-04T08:32:30+00:00,Tak tu připomínku něčím přepíšu dokud to jde.,0,2,48481682,julim,disqus_gHkdX6vYxc,,2.1455140000000004,2017-01-11T04:09:49.994417+00:00
3082283373,65575520,2017-01-04T08:30:52+00:00,"Souhlasím s Vámi, s Kalouskem jsme si užili 2 delší poklesy HDP, a jeden dokonce v době, kdy všechny okolní ekonomiky rostly, takže to nemůže svádět na vnější vlivy. Rozhodně nepatřím k jeho fanatickým obdivovatelům.. 
Jen si myslím, že dluh je obrovské břemeno, pokud se neřeší, nebo neexistuje plán, jak ho snížit. Ono ty záporné úroky ze státních dluhopisů vyvolané politikou ČNB nevydrží věčně. A pokud v budoucí krizi začnou bankrotovat některé předlužené země v Evropě, hrozí, že budeme muset platit za obsluhu dluhu mnohem vyšší částky než jsme byli zvyklí.",0,0,125155974,Jan Kotas,jankotas,Brno,1.383947,2017-01-11T04:09:49.994417+00:00
3082282506,65575520,2017-01-04T08:29:31+00:00,"Dobrý den, děkujeme za upozornění, už jsme na jeho základě chybu opravili.",0,0,195753422,Janis Aliapulios,janisaliapulios,,1.2339689999999999,2017-01-11T04:09:49.994417+00:00
3082277179,65575520,2017-01-04T08:21:33+00:00,"Kalousek u nás nesmyslným šetřením uprostřed krize tuto krizi jen prodloužil. Nám žádné ""Řecko"" nehrozilo. Jenom se právě zastavila příprava výstavby dálnic atd.",0,0,32281575,Pepa25,Pepa25,,2.586029,2017-01-11T04:09:49.994417+00:00
3082276124,65575520,2017-01-04T08:20:03+00:00,"Jak relativní? Úroky ze státního dluhu jsou rekordně nízké, za celý rok asi 40 mld. a budou dále klesat (platí se vyší pevné úroky na dříve vydané dluhopisy). Splácet dluh je nyní ekonomický nesmysl, mělo by se hlavně investovat do toho, co se stejně musí udělat a za pár let si na to budeme půjčovat za 4-5% ...",0,0,32281575,Pepa25,Pepa25,,2.586029,2017-01-11T04:09:49.994417+00:00
3082275210,65575520,2017-01-04T08:18:35+00:00,"Investovat, když nemáte připraveny projekty, znamená ""utratit před volbami"". Sám jste si na to odpověděl. A Kalouska se nezastávám, taky mi leží v žaludku, ale s tím státním dluhem měl pravdu a aspoň dokázal zvýšit povědomí u běžných lidí, kteří si myslí, že dluhy řešit netřeba.",2,0,125155974,Jan Kotas,jankotas,Brno,1.383947,2017-01-11T04:09:49.994417+00:00
3082271442,65575520,2017-01-04T08:12:51+00:00,"Utratíme? Čtu, že to chtějí investovat. Problém je, že Kalousek, Bárta a podobní experti zakázali připravovat investice, Nečasova vláda chtěla ekologické zakázky řešit supertendrem za 60 mld. a když neprošel, tak projekt připravit tak, aby se na ně dávalo každý rok 2-3 mld. nešlo ... Takže souhlasím se Seidlerem: lepší by bylo investovat, ale bohužel nejsou připravené žádné projekty",0,0,32281575,Pepa25,Pepa25,,2.586029,2017-01-11T04:09:49.994417+00:00
3082266688,65575520,2017-01-04T08:05:12+00:00,"To bylo keců, že je třeba snížit státní dluh, ale pro socany (ČSSD, KDU) je teď před volbami mnohem důležitější heslo: ""utratíme, co můžem"" nebo Paroubkovské ""Dluhy se platit nemusí"". Sobotka nikdy nebyl dobrý hospodář a za jeho časů jako ministra financí se rozmohlo žití na dluh naplno, i když ekonomika slušně rostla.
Až nějaký budoucí Kalousek bude posílat složenku kojencům, že dluží x- stovek tisíc Kč jako svůj podíl na státním dluhu, tak si na Vás vzpomenu.",2,0,125155974,Jan Kotas,jankotas,Brno,1.383947,2017-01-11T04:09:49.994417+00:00
3082245206,65575520,2017-01-04T07:45:41+00:00,"Investice, investice, investice.
A všichni ví, jak investovat.",0,0,124033019,economistor,economistor,,1.601893,2017-01-11T04:09:49.994417+00:00
3082181812,65575520,2017-01-04T06:38:17+00:00,"""optimalizace teritoriální dělby práce a osídlení""....
to je hezky řečeno. Ale mám obavu, že pro většinu voličů ANO zcela nesrozumitelné :-)",0,0,106192024,Sherlock Houmeles,antonintony,,10.170761,2017-01-11T04:09:49.994417+00:00
3082175983,65575520,2017-01-04T06:28:58+00:00,"Vim, ze se to dneska vubec nenosi, ale ja bych to dal na splaceni dluhu.",6,0,141324560,Paulika,disqus_4WkYEJIw06,,1.706147,2017-01-11T04:09:49.994417+00:00
3082169836,65575520,2017-01-04T06:19:21+00:00,"Jesti ty peníze se dají na snížení státního sluhu a nebo se ponechají do roku 2017 je snad úplně jedno, kromě formálních záležitostí a komplikací, které si tu sami vymyšlíme, je to prašť jako uhoď.",0,0,48481682,julim,disqus_gHkdX6vYxc,,2.1455140000000004,2017-01-11T04:09:49.994417+00:00
3082168219,65575520,2017-01-04T06:16:57+00:00,"ponechat do roku 2017, alespoň MF a MZ nebudou mít důvod opožďovat platby dotací a dávek zemědělcům, tak jak se už tady v tom ""pořádku"" pomalu stává zvykem. A ty si pak zemědělče pomož jak můžeš a krm zbytečně nenažrané banky abys pak včas splatil splátku třeba traktoru či vazače.",2,0,48481682,julim,disqus_gHkdX6vYxc,,2.1455140000000004,2017-01-11T04:09:49.994417+00:00
3082107867,65575520,2017-01-04T04:56:36+00:00,"Ten přebytek státního rozpočtu je ovšem jen relativní ve vztahu k obsluze státního dluhu. S investicemi do dopravní infrastruktury bych to nepřeháněl, problémy dopravy resp. přepravy do budoucna vyřeší jen jejich  racionalizace (to ale souvisí nejen s technologickými a organizačními systémy provozu, ale i s optimalizací teritoriální dělby práce i osídlení).",3,0,103414841,Jan Vacek,jan_vacek,,1.3926729999999998,2017-01-11T04:09:49.994417+00:00
3083973076,65575280,2017-01-05T09:20:58+00:00,"A v cem je Babis lepsi? Vzdyt je mnohem nebezpecnejsi nez cely Zeman. Pockejte po volbach, az bude mit moc ve svych rukou a bude vladnout s komunisty. je mi k smichu kazdy volic co tvrdi, ANO volim, ale na Zemana plivu.",0,0,224141254,Klára Vokounová,klravokounov,,1.32986,2017-01-11T04:09:49.994417+00:00
3083914255,65575280,2017-01-05T07:45:00+00:00,jistě že ano:) to se s vámi klidně vsadím o výplatu:),0,0,139636134,osirismp,osirismp,,1.61096,2017-01-11T04:09:49.994417+00:00
3083913940,65575280,2017-01-05T07:44:31+00:00,"nedivím se vám, ale v téhle době už nikoho nezajímá jak to skutečně je, proto nikoho nezajímá že tito 2 jsou skutečným výkvětem ubohosti v ČR.. jsme holt odsouzeni k úpadku.",0,0,139636134,osirismp,osirismp,,1.61096,2017-01-11T04:09:49.994417+00:00
3083912758,65575280,2017-01-05T07:42:39+00:00,"takže všichni co mají jiný názor než vy mají držet hubu a krok a pak bude vše ok?

A co to tak udělat obráceně? :)",0,0,139636134,osirismp,osirismp,,1.61096,2017-01-11T04:09:49.994417+00:00
3083911829,65575280,2017-01-05T07:41:10+00:00,to je komedie :D 2 pancharti se domlouvají na moci,0,0,139636134,osirismp,osirismp,,1.61096,2017-01-11T04:09:49.994417+00:00
3083300689,65575280,2017-01-04T22:23:56+00:00,Ano,0,0,120113959,Petrpetr,disqus_ZQgNFo3AYw,,1.307936,2017-01-11T04:09:49.994417+00:00
3083273156,65575280,2017-01-04T22:02:11+00:00,"Oba si lezou do zádele poměrně dlouho, jak jinak by to jako mělo dopadnout...",0,0,130897230,Alexandr Tesař,alexandr_tesa,,1.739769,2017-01-11T04:09:49.994417+00:00
3083022096,65575280,2017-01-04T19:08:50+00:00,"Ale neztrati. Kdyz tem lidem nevadi, ze vubec nevi, co ANO udela(lo) vcera, dnes a zitra, je uplne jedno, ze budou podporovat Zemana.",0,0,101269427,Jan Gryc,jangryc,,1.635832,2017-01-11T04:09:49.994417+00:00
3082944610,65575280,2017-01-04T18:13:19+00:00,"Všichni proti lumpenkavárně... To jen proto, že nechlastá i v pracovní době? Nebo proto, že neleze do zadku číňanům a rusům? Nebo jen proto, že nesouhlasí s rusy obklopeným prezidentem?",0,0,209929187,Felician Octavius,felicianoctavius,,1.247893,2017-01-11T04:09:49.994417+00:00
3082940480,65575280,2017-01-04T18:10:42+00:00,"I když to tak možná nevypadá, ANO volí spousta pravicových voličů (kam jinam by se vytratili bývalí podporovatelé ODS a TOP09). Pokud ANO podpoří Zemana, může ztratit velké množství svých podporovatelů.
To jsme tak zoufalý národ, že nedokážeme najít lepšího prezidenta než je Zeman???",1,0,209929187,Felician Octavius,felicianoctavius,,1.247893,2017-01-11T04:09:49.994417+00:00
3082937725,65575280,2017-01-04T18:08:41+00:00,"Pokud by ANO podpořilo Zemana, určitě bych jej nevolil. Ale pokud jej podpoří, udělají to až po volbách do PS...",0,0,209929187,Felician Octavius,felicianoctavius,,1.247893,2017-01-11T04:09:49.994417+00:00
