id,article_id,date,message,likes,dislikes,user_id,user_name,user_username,user_location,user_reputation,scraped_date
3083898708,65576930,2017-01-05T07:21:10+00:00,"Takže lži slevy po kterých bude zboží pořád dražšší než jinde budou pokračovat? To je teda výhra. Psí žřádlo, když jsem viděl dTest, kde rozdíli v celkovém hodnocení u granulí byli jen pár procent takže je skutečně fuk jeslti koupím Lidl granule, mountfield nebo Eucanuba, pes dostane i v levných to co potřebuje jen to stojí třeba čvtrtinu než drahé :-)",1,0,97311476,Aleš Chocholoušek,alechocholouek,,1.29849,2017-01-11T04:08:31.365013+00:00
3083916896,65576390,2017-01-05T07:49:16+00:00,"Zas jedna myšlenka, která ja k ničemu, Stavebnictví není strojírenství, Kolik projektů má stejné opakující se podmínky. tohle je chiméra a ještě to pojmenovat Stavebnictví 4.0... to jsou opravdu nápady.-))",0,0,237534759,Michal Jezek,michaljezek,,1.232124,2017-01-11T04:08:31.365013+00:00
3084127449,65575840,2017-01-05T12:32:02+00:00,"Presiel som na fio, ked mbank spoplatnila debetky za 1,3 e mesacne",0,0,204650991,Lehti Lekimen,lehtilekimen,,1.189347,2017-01-11T04:08:31.365013+00:00
3083009297,65575840,2017-01-04T18:59:41+00:00,"M-Bank,chtěl jsem si tam zřídit účet,ale potom jakým způsobem se mnou jednali,nikdy.Jsem rád,že jsem to neučinil,a děkuji jejich pracovníkům,že mě od tohoto šíleného činu odradili.",0,0,138249842,Milan Velcl,milanvelcl,,1.389279,2017-01-11T04:08:31.365013+00:00
3082943869,65575840,2017-01-04T18:12:48+00:00,"mBank ukázala, jak je možné neskutečnou podporu a sympatie klientů během velice krátké doby promrhat a pošlapat. Být členem té komunity koncem roku 2007 byl úchvatný zážitek. Když banka měla problém, klienti jí ho prominuli nebo pomohli vyřešit. Jenže pak se banka otočila ke klientům zády.
Nevadí mi, že změnila pravidla, když ta stávající byla neudržitelná. Vadilo mi, jak kolem toho mlžila. Od roku 2014 pak banka pracuje v režimu permanentní změny podmínek (jen málokdy k lepšímu), což je hodně velký problém.

Mimochodem, vkladomaty byly slíbeny na polovinu roku 2008, cizoměnové účty na rok 2009... Co dodat?",3,0,155528096,Tetřev Honzlovec,tet_ev_honzlovec,,1.8786899999999997,2017-01-11T04:08:31.365013+00:00
3082852313,65575840,2017-01-04T17:10:16+00:00,Uz se stalo. Platit 29Kc za 2. a dalsi prevod z interniho sporiciho uctu je mazec.,1,0,135525949,JirkaA,disqus_cRaVZHQYn4,,1.2547389999999998,2017-01-11T04:08:31.365013+00:00
3082690156,65575840,2017-01-04T15:21:14+00:00,To fakt brzo.,0,0,123877799,Only James,onlyjames,,1.331065,2017-01-11T04:08:31.365013+00:00
3082598622,65575840,2017-01-04T14:14:18+00:00,"ja jsem spise konzervativneji zalozeny, takze se rozhoduji ponekud dele :)",0,0,100091398,hotovson,hotovson,,2.6371320000000003,2017-01-11T04:08:31.365013+00:00
3082592697,65575840,2017-01-04T14:09:35+00:00,Ja udelal jiz pred pul rokem. Dohnalo mne k tomu spoplatneni kreditky. Tak jsem rovnou zrusil i ucty. Jako druhy ucet nyni vyuzivam Equa bank.,0,0,151744913,Lada,Ladu1,,1.450871,2017-01-11T04:08:31.365013+00:00
3082557946,65575840,2017-01-04T13:49:33+00:00,nastal cas udelat mBank papa,0,0,100091398,hotovson,hotovson,,2.6371320000000003,2017-01-11T04:08:31.365013+00:00
3082557711,65575870,2017-01-04T13:49:22+00:00,"Za komoušů se tomu říkalo ""přes průsery ke hvězdám!"" Něco podobného si za své případné neúspěchy ""zaslouží"" např. i GŘ České pošty. Tomu při vyhazovu z pozice ""hrozí"" dvanáct průměrných měsíčních platů, což je částka v řádu miliónů korun. Ovšem ve srovnání se svými ""kolegy z vyspělé Evropy"" je to pořád ještě žabař... http://ekonomika.idnes.cz/odborum-vadi-8-milionu-pro-elkana-dou-/ekoakcie.aspx?c=A161219_143718_ekoakcie_fih",0,0,131072217,McMillan,milan_cihl,Translyvánie,1.418316,2017-01-11T04:08:31.365013+00:00
3082488680,65575870,2017-01-04T12:46:50+00:00,"Tak mu přeji, ať si ten důchod užije. Zaslouží si to, klučina jeden!
Práce v korporacích je velmi stresujíci a není nutné vedoucí pracovníky trestat za každou odhalenou chybičku, zvláště když na tom VW v konečném důsledku neprodělá. Ztráty v USA rádi uhradí Evropané, kteří s k těm nesmyslným žalobám nepřipojili.",0,0,216952721,Jiří Novák,disqus_KYH5eGXaL2m,,0.5754319999999998,2017-01-11T04:08:31.365013+00:00
3082484470,65575870,2017-01-04T12:42:40+00:00,Takhle se to dělá ne nějaké podnikání hezky být zaměstnancem a nahrabat si s nulovou zodpovědností! Mnohé platy a mzdy včetně příslušenství jsou pouhými zlodějnami!,0,0,237031485,Kecy01,kecy01,,1.247792,2017-01-11T04:08:31.365013+00:00
3082823969,65575880,2017-01-04T16:50:16+00:00,"Jojo, v loni jsem koupil Ford Focus 1.5 TDCI 69kw, tak se to projevilo koukám :)",0,1,206368707,Josef Dostál,josefdostl,,1.244615,2017-01-11T04:08:31.365013+00:00
3082569248,65575880,2017-01-04T13:51:54+00:00,"Jeden den se doctu, ze lide uz prestavaji kupovat jina auta nez SUV, druhy den, ze leti mala a usporna auta...",3,0,107587388,Hektik,disqus_3aJ2twCQ2Y,,4.225264000000001,2017-01-11T04:08:31.365013+00:00
3083144585,65575760,2017-01-04T20:24:22+00:00,"zajimalo by mne tedy, zda je zrychleni inflace v CR skutecne zasluha nasi centralni banky a jejich intervenci/oslabeni koruny, ci zda se pouze vezeme s eurozonou. To druhe mi dava celkem smysl, ale samozrejme nejsem zadny expert",0,0,32667849,tomas,disqus_nPP0lyZwTi,,1.3545669999999999,2017-01-11T04:08:31.365013+00:00
3083958756,65575680,2017-01-05T08:57:58+00:00,"Části stěžujících restauratérů z Prahy nepochybně vadí více to, že prodloužené odezvy i ""pády systému"", nedovolují jako dříve snadno zatajovat tržby, neodvádět DPH, které jim zákazníci zaplatili v ceně zboží a služeb, prodávat kradené, neproclené, nezdaněné zboží a suroviny, včetně nakoupeného mimo účetní evidenci.",0,0,132954791,Malý Jarda,maljarda,,3.2331059999999994,2017-01-11T04:08:31.365013+00:00
3083016809,65575680,2017-01-04T19:05:03+00:00,"jen by me zajímalo, co to musí byt za individum, co jde udavat na zivnostak o nevydani uctenky. Proste takovy odporny, zamindrakovany, neschopny a zavistivy chudacek.",0,0,67677486,Jirka Waggon,jirkawaggon,,1.738789,2017-01-11T04:08:31.365013+00:00
3082434663,65575680,2017-01-04T11:49:27+00:00,"""Podle Sdružení místních samospráv České republiky zaniklo při spouštění EET na 700 hospod zejména v malých obcích.""

toto je lez jako vez, viz rozhovor se zastupcem samosprav dnes na CRO Plus po 10:10",0,0,100091398,hotovson,hotovson,,2.6371320000000003,2017-01-11T04:08:31.365013+00:00
3082427214,65575680,2017-01-04T11:40:50+00:00,"""Například v Pardubickém kraji ukončilo živnost 261 podnikatelů, což je přibližně 3,5krát více než předloni ve stejnou dobu.""

skutecne nezavisly novinar by pripojil informaci, kolik zivnosti za stejnou dobu vzniklo",0,0,100091398,hotovson,hotovson,,2.6371320000000003,2017-01-11T04:08:31.365013+00:00
3082414341,65575680,2017-01-04T11:24:57+00:00,"Situace ve městě cca 9000 obyvatel: skončily 3 restaurace-hospody- bary. Jedna, protože po novém nařízení MÚ nemohly být v provozovně automaty a majitel je v otázce nájemného ""nenasytný"", druhá, protože bylo veřejným tajemstvím, že sloužila k ""daňové optimalizaci"" firem pronajímatele a třetí, protože ji zazdil provozovatel s obsluhou svým chováním. Vše ostatní funguje ok, naopak dvě, dříve uzavřené hospody obnovily provoz. 
takže - u mě dobrý :-))",1,0,227728555,api,disqus_NVeLWpVgri,,1.258942,2017-01-11T04:08:31.365013+00:00
3082383716,65575680,2017-01-04T10:44:47+00:00,"Kontrolní nákup dělají ti, co pracují na FÚ a do restaurace chodí na oběd?",0,0,233807344,Mirek,disqus_Z214hq3cWA,,1.2409249999999998,2017-01-11T04:08:31.365013+00:00
3082371144,65575680,2017-01-04T10:27:48+00:00,V Čapím hnízdě i v restauraci Paloma prý vše funguje bezvadně!,0,0,183800265,s-l,disqus_OgBPVnfAtB,,1.488864,2017-01-11T04:08:31.365013+00:00
3092330599,65581560,2017-01-10T14:22:26+00:00,taky to obvykle napíšu s oo.,0,0,168762393,Petr Houzar,petrhouzar,,2.126958,2017-01-11T04:09:49.994417+00:00
3092252879,65581560,2017-01-10T13:22:14+00:00,"Mně pořád přijde nejlepší googlení - a gúglení můj vytříbený lingvistický vkus uráží nejvíc :-)
Jelikož je Google název vyhledávače, přijde mi takové nelogické počešťovat sloveso z něho vzniklé. Gúglím v Googlu? To spíš googlím v Googlu.",0,0,217315280,mirliflore,mirliflore,Czech Republic,1.53817,2017-01-11T04:09:49.994417+00:00
3092237208,65581560,2017-01-10T13:08:10+00:00,Já teda gůglím s kroužkem ;).,0,0,168762393,Petr Houzar,petrhouzar,,2.126958,2017-01-11T04:09:49.994417+00:00
3092233768,65581560,2017-01-10T13:04:59+00:00,"Horší než gúglení je tvorba přídavných jmen v anglickém stylu, např. Vitana polévky, iOS zařízení, android aplikace atp.",0,0,112371254,Jigga,igsterious,,2.3730830000000003,2017-01-11T04:09:49.994417+00:00
3092876036,65581390,2017-01-10T19:51:44+00:00,"Rozdíl mezi roční těžbou u Lesů ČR zjištěnou inventarizací a roční těžbou vykázanou v evidenci činí 1,41 milionu kubíků dřeva, u ostatních vlastníků je to 2,41 milionu. ---------- Podlé této věty ale Lesy ČR se správou cca 50% lesů dopadli o 100 % lépe než jiní vlastnicí - tak to jsou na tom lesy cr hodně dobře ne ???",0,0,238241589,Tomáš Mates Matýsek,tommatesmatsek,,1.232124,2017-01-11T04:09:49.994417+00:00
3092862484,65581390,2017-01-10T19:42:42+00:00,"nejdřív se to rozkrade,a pak se to různým způsobem změří----",0,1,31246304,mdpisek,mdpisek,,1.299238,2017-01-11T04:09:49.994417+00:00
3092392874,65581390,2017-01-10T15:05:00+00:00,"""Lesníci pátrají, kam zmizely miliony kubíků dřeva. Odhalil to audit za miliony.""
---
Jo - pořád se něco děje - svět nezastavíš - pokrok pádí na splašené kobyle. Ještě nedávno platilo: ""KDYŽ SE KÁCÍ LES, LÉTAJÍ TŘÍSKY"", dnes je doba financí a už dávno nelétají jen nezajímavé třísky, ale i MILIONY! :)

Nebo další pokrok ve vývoji, jedna ministryně kultury - Alena Hanáková se kdysi zasekla jako gramofonová deska u termínu PROCESY - PROCESY - PROCESY, ale žijí i dál a konečně v praxi -  další ministr kultury - už na jednom procesu pohořel, čtu na jiném místě, že: ""Exministr kultury Balvín dostal za korupci desetiměsíční podmínku a pokutu čtvrt milionu korun"", víc nevím, nemám předplatné, ještě že v pražské dopravě my kmeti smíme jezdit už zdarma, ale tam už zase vymizely ty nalepené, v 50. letech tak poutavé a čtivé, letáky na oknech. :) Musíme se tedy u nějakých článků spokojit jen s titulkem a děj se nám pak ztrácí v mlze z nedostatku finančních prostředků. My se ale musíme přiznat, že ve stáří nám ty samé mlhavé pohledy už nabízí i normální běžný život - když se chceme třeba jen podívat, kolik je na věži hodin. Prý to už patří k našemu věku.",0,1,123150899,Martin1,disqus_QRVpvgPYVN,,4.509473,2017-01-11T04:09:49.994417+00:00
3091903843,65581580,2017-01-10T06:59:49+00:00,Historicky rekordní záporný schodek :),0,0,168762393,Petr Houzar,petrhouzar,,2.126958,2017-01-11T04:09:49.994417+00:00
3091777006,65581580,2017-01-10T04:18:27+00:00,"Už ZASE po sobě nečtete? V posledním odstavci: ""Historicky rekordní schodek státního rozpočtu zapříčinily dvě věci. ...""? Tak schodek nebo přebytek?",0,0,106192024,Sherlock Houmeles,antonintony,,10.170761,2017-01-11T04:09:49.994417+00:00
3091901380,65580920,2017-01-10T06:55:35+00:00,"V roce 1993 byl celý rozpočet 342,2 mld Kč. Tam nic zahrnováno nebylo.",0,0,168762393,Petr Houzar,petrhouzar,,2.126958,2017-01-11T04:09:49.994417+00:00
3091150748,65580920,2017-01-09T20:36:51+00:00,Já mám hlad každý den.,0,0,129564558,Piják Rumový,PijakRumovy,,1.558838,2017-01-11T04:09:49.994417+00:00
3091104502,65580920,2017-01-09T20:06:04+00:00,"Dobře, co bude v přebytku, dám vám já, co bude v deficitu,  dáte vy mě, aby vás to tak nebolelo, škrtneme 6 nul. ",0,0,227489678,Michal,disqus_I5GZWIKzWF,,1.679371,2017-01-11T04:09:49.994417+00:00
3091095740,65580920,2017-01-09T20:00:19+00:00,Klidne se svama vsadim ze bude do 20mld. Mate na to koule?,0,0,151744913,Lada,Ladu1,,1.450871,2017-01-11T04:09:49.994417+00:00
3091092745,65580920,2017-01-09T19:58:22+00:00,Mate vy vubec prehled o fungovani dluhopisu nebo jedete jenom mainstrean co najdete v clancich na internetu. Spise myslim ze to druhe...,0,0,151744913,Lada,Ladu1,,1.450871,2017-01-11T04:09:49.994417+00:00
3091088501,65580920,2017-01-09T19:55:38+00:00,Jak jinak...po socansku.,0,0,151744913,Lada,Ladu1,,1.450871,2017-01-11T04:09:49.994417+00:00
3091025405,65580920,2017-01-09T19:16:10+00:00,"Ano, rozumné by to bylo při vysokých úrokových sazbách. Při současných sazbách by bylo správné vrátit nejdříve Klausem ukradené peníze z důchodového fondu v r. 1993 a pak platit dluhy.",0,1,48481682,julim,disqus_gHkdX6vYxc,,2.1455140000000004,2017-01-11T04:09:49.994417+00:00
3091021276,65580920,2017-01-09T19:13:40+00:00,"Hlavně to neprožrat. Pro výpočty důchodů platí jednoznačné vzorce a tak by nemělo hrozit, že to zase nějaký zloděj ukrade jako v r.1993. Pokud by platilo, že  deficit na důchodovém účtu bude moci být hrazen z této rezervy a ne z běžného ročního rozpočtu, tak to není špatný nápad. V době záporných úrokových sazeb na státních dluhopisech by byla by hloupost splácet dluh.  Ona 333 mld. částka, kterou v roce 1993 zahrnul Klaus do rozpočtu by při stejné metodice valorizace odvodů pojištění jako při výpočtu důchodů dnes znamenala cca 3 bil. Kč. Takže i přes dotace z rozpočtu do průběžného systému v posledních letech, pořád je do rezervního fondu co vracet.",0,0,48481682,julim,disqus_gHkdX6vYxc,,2.1455140000000004,2017-01-11T04:09:49.994417+00:00
3090946497,65580920,2017-01-09T18:29:57+00:00,Politický podnikatel který nakupuje voliče za jejich peníze neni ekonomický analfabet ale defraudant !,1,0,193514238,matěj,disqus_mGnjJ0Ow3D,,1.3038239999999999,2017-01-11T04:09:49.994417+00:00
3090935235,65580920,2017-01-09T18:24:18+00:00,"Zase chcou krájet medvěda. Jsou to peníze, o které si budeme muset příští rok půjčit méně při refinancování dluhů. To je jediný rozumný způsob jak ty peníze využít.",0,0,195564799,Martin Bartek,disqus_qqNy9fn6ws,,1.335513,2017-01-11T04:09:49.994417+00:00
3090889561,65580920,2017-01-09T17:59:45+00:00,Máte recht....5x Zacapa !!,0,0,183800265,s-l,disqus_OgBPVnfAtB,,1.488864,2017-01-11T04:09:49.994417+00:00
3090863374,65580920,2017-01-09T17:43:25+00:00,"To by bylo 6 000, když už.",0,0,168762393,Petr Houzar,petrhouzar,,2.126958,2017-01-11T04:09:49.994417+00:00
3090820401,65580920,2017-01-09T17:16:13+00:00,Tak to bych spíš čekal 2 Tuzemáky :-),0,0,183800265,s-l,disqus_OgBPVnfAtB,,1.488864,2017-01-11T04:09:49.994417+00:00
3090793907,65580920,2017-01-09T16:58:55+00:00,"Spravedlivě to rozdělíme, 60Kč na hlavu. Koupím si do práce bagetu!",0,0,129564558,Piják Rumový,PijakRumovy,,1.558838,2017-01-11T04:09:49.994417+00:00
3090743337,65580920,2017-01-09T16:27:11+00:00,Pan president je moudřejší než někteří ministři ale ti mají tvrdou hlavu jak berani i s tím co je v ní.,0,0,97480345,jaro,disqus_carTp4cTrD,krnov,1.378615,2017-01-11T04:09:49.994417+00:00
3090729577,65580920,2017-01-09T16:18:18+00:00,"Ne nic, jedině na splátku dluhu, zase by to v něčem prožrali. A jaký schodek v příštîm roce? Vždyť podle mnoha lidí byl přebytek zásluhou Babiše a ten bude ministrem i tento rok, tak čekám opět minimálně stejný přebytek. ",0,0,227489678,Michal,disqus_I5GZWIKzWF,,1.679371,2017-01-11T04:09:49.994417+00:00
3092067990,65580800,2017-01-10T10:29:20+00:00,protože Karel Marel ... :p,0,0,142858562,Cyrda,disqus_6aQDgbCOOP,,1.261375,2017-01-11T04:09:49.994417+00:00
3091982441,65580800,2017-01-10T08:59:55+00:00,Tak to nečtěte.,0,0,229413634,hej Hombre,hej_hombre,,1.278564,2017-01-11T04:09:49.994417+00:00
3091930890,65580800,2017-01-10T07:45:09+00:00,"Veľkopodnikateľov a bankárov nik nevolí, ale oni lobujú (uplácajú a intrigujú) a ovplyvňujú rozhodujúce obchodné a daňové zákony t.j. sú šedou eminenciou zákonodarstva  v štáte. Keby ľudia volili a hlavne tvrdo kontrolovali volených politikov veľa podnikateľských dodbrodruhov a kriminálnikov by pochoipila, že to nemá význam. Krásnym príklad je korupčník a úplatkár Rath, využíva, že sudca nie je osobne zodpovedný za svoje rozsudky. Ak by voliči nekompromisne trvali na tom, že sudca je doživotne zodpovedný za svoje rozsudky a ručí za ne svojim majetkom aj dôchodkom a ak by mu hrozilo počas celého života, tvrdý finančný postih a prepadnutie sa do sociálnej siete t.j. jeho osobný majetok a dôchodok by bol použitý na splácanie následkov jeho rozsudkom a zostalo by mu len nevyhnutné životné minimum, mnohé by sa zmenilo.",0,0,181085952,Michal,disqus_4Uec8UWGr9,,1.341496,2017-01-11T04:09:49.994417+00:00
3091906343,65580800,2017-01-10T07:04:03+00:00,Velkopodnikatle někdo volí do svých podnikatelských funkcí? To je nějaká novinka na Slovensku?,0,0,123731190,Karel Marel,karelmarel,,2.15686,2017-01-11T04:09:49.994417+00:00
3091905599,65580800,2017-01-10T07:02:48+00:00,"Jak to bylo s presidentskou volbou a jejím ovlivněním. Sice to již řekl soud, ale on ví asi ještě něco navíc. Nebo něco s mrázkovým archivem?",0,0,123731190,Karel Marel,karelmarel,,2.15686,2017-01-11T04:09:49.994417+00:00
3091904841,65580800,2017-01-10T07:01:32+00:00,Napíšete PutIn a zdejší cenzůra už příspěvek prověřuje. Proč asi?,0,0,123731190,Karel Marel,karelmarel,,2.15686,2017-01-11T04:09:49.994417+00:00
3091904106,65580800,2017-01-10T07:00:17+00:00,"Dře jako kůň, Putin má na něj vysoké nároky.",1,0,123731190,Karel Marel,karelmarel,,2.15686,2017-01-11T04:09:49.994417+00:00
3091636922,65580800,2017-01-10T02:18:22+00:00,"Jestli ty peníze jdou ze státního rozpočtu a tedy z našich daní tak výdaje za ""Ovčáčkovo superžvanění"" jsou velmi nadlimitní.",2,0,144563762,Liberty,disqus_Q7CrXr1pwA,,1.870291,2017-01-11T04:09:49.994417+00:00
3091054088,65580800,2017-01-09T19:34:10+00:00,"Ještě napište,  jak a kam a komu  tečou peníze ve veřejnoprávních médií, jaké tam mají platy. Politici jsou placeni z daní , tahle média kromě příjmů z reklamy vybírají peníze od nás. Tak by měla také průhledně hospodařit.",1,1,197467396,Ramba,disqus_pEgdPmVes9,,1.241634,2017-01-11T04:09:49.994417+00:00
3090900216,65580800,2017-01-09T18:06:28+00:00,"já jim částky nezávidím, vydělám si poctivou prací víc ... ale štve mě, že musím platit takové kreatury, jako je Mynář ... ten fakt nosil kůži na trh ... a kupoval si vily od mafiánů za nedoložený peníze. exkrement",4,0,130172811,Loki Beard,lokibeard,,3.063218,2017-01-11T04:09:49.994417+00:00
3090729786,65580800,2017-01-09T16:18:26+00:00,"Tak ony to nejsou zase bůhvíjaké peníze za to, že nesete kůži na ostře sledovaných postech. A uvědomte si, že jsou to brutto platy a na účet jim chodily zhruba pouhé dvě třetiny uvedených částek.",0,0,123788317,Prokop,disqus_NlQ7T2fy9z,,1.318686,2017-01-11T04:09:49.994417+00:00
3090673666,65580800,2017-01-09T15:42:41+00:00,"Politici, sudcovia a bankári/veľkopodnikatelia si sami sebe určujú platy prostredníctvom občanmi zvolených zástupcov - poslancov t.j. stláčaním tlačítka - hlasovaním. Takže všetko v zmysle zákona. A sám pripúšťam, že ročný plat 75 000 € nie je v rámci ČR žiadny zázrak. Uvedomujem si že keď má niekto 5-7000 € ročne t.j. desatinu zdá sa to mnoho, ale závisť to je taká stredoeuropská spoločenská choroba.",0,2,181085952,Michal,disqus_4Uec8UWGr9,,1.341496,2017-01-11T04:09:49.994417+00:00
3090624051,65580800,2017-01-09T15:09:00+00:00,"Po dalsim rozhovoru s Bleskem, by bylo nejlepsi kdyby se vymenil cely hradni urad i s jejich prednostou. To uz se neda cist.",0,0,172965592,Aranka Homfeld,arankahomfeld,,2.435371,2017-01-11T04:09:49.994417+00:00
3090594956,65580800,2017-01-09T14:48:03+00:00,to se vegetí z naších daní !!!,1,0,236879123,dave,disqus_uwtke5kzqN,,1.256322,2017-01-11T04:09:49.994417+00:00
3090551395,65580800,2017-01-09T14:19:06+00:00,"Volové v podhradí ,to čumíte jak se vydělávají peníze -a ještě si z vás dělají blázny. Opět si zvolte podobný spolek padlých holek.",4,0,102113073,Shangri  La,putinvpucflek,Jičín,1.947101,2017-01-11T04:09:49.994417+00:00
3090531361,65580800,2017-01-09T14:05:26+00:00,"Prachy jím nezávidím, ale kdyby alespoň trošičku reprezentovali a mohl být občan na ně hrdý! Jeden větší křivák, než druhý, že je hanba nefackuje!",1,0,147206167,Jiří Jirousek,jijirousek,,1.392468,2017-01-11T04:09:49.994417+00:00
3090521900,65580800,2017-01-09T13:57:49+00:00,"Za co odmeny? Odkdy urednici maji na neco takoveho narok? 
Mozna za to, ze to musi s hlavou statu vydrzet. ☺",4,0,172965592,Aranka Homfeld,arankahomfeld,,2.435371,2017-01-11T04:09:49.994417+00:00
3090520473,65580800,2017-01-09T13:56:41+00:00,"Kroutí se mi žaludek, když vidím, kdo je z mých daní živ, a hlavně jak dobře! 2 mega ročně? Za co, Vráťo! Za co?!",2,0,120648372,Majkina,majkina,,1.35667,2017-01-11T04:09:49.994417+00:00
3090514940,65580800,2017-01-09T13:52:10+00:00,"Xakru, co jen ten Vrata na toho Miloska vi? Nejvetsi tajemstvi Hradu. Chtelo by to provetrat. Pak jeho cena pujde dolu.",2,0,141324560,Paulika,disqus_4WkYEJIw06,,1.7060490000000001,2017-01-11T04:09:49.994417+00:00
3090514436,65580800,2017-01-09T13:51:47+00:00,"Bodejť by se Mynář nedržel takového koryta, prověrka - neprověrka.",3,0,107792219,Ladič,disqus_v3FtsMuP4f,,2.783324,2017-01-11T04:09:49.994417+00:00
3091131736,65580790,2017-01-09T20:23:52+00:00,"Ano, ano.",0,0,159521739,M.,disqus_zVt5H90fLk,,1.297265,2017-01-11T04:09:49.994417+00:00
3090812844,65580790,2017-01-09T17:11:15+00:00,Ty se převedly nám spořivým přímo na účet.,0,0,168762393,Petr Houzar,petrhouzar,,2.126958,2017-01-11T04:09:49.994417+00:00
3090710260,65580790,2017-01-09T16:05:58+00:00,"Právě, že nepřevedly. V tom byla celá ta finta. Člověk tak mohl mít velmi výhodně ""úročený"" spořící účet.",0,0,159521739,M.,disqus_zVt5H90fLk,,1.297265,2017-01-11T04:09:49.994417+00:00
3090677481,65580790,2017-01-09T15:45:08+00:00,Nepřevedly se už peníze z těch tří procent přesměrovaných do 2. pilíře po jeho zrušení zpátky do rozpočtu ČSSZ?,0,0,135533965,dacan.strom,dacan_strom,,4.697852999999999,2017-01-11T04:09:49.994417+00:00
3091903798,65580720,2017-01-10T06:59:45+00:00,"LŽemanův kamarád, tak se nedivme.",0,0,123731190,Karel Marel,karelmarel,,2.15686,2017-01-11T04:09:49.994417+00:00
3092826383,65580300,2017-01-10T19:18:58+00:00,Vy ste chytrej.  Ale jste ho prokouk! ,0,0,126226619,kuko,Swantawit,,1.2423039999999999,2017-01-11T04:09:49.994417+00:00
3092447326,65580300,2017-01-10T15:41:06+00:00,"Ano ma,ale snaha eurohujerov bolo toto pravo obmedzit.Nastastie to tymto sociopatom nevyslo,ale to neznamena,ze sa o to nebudu pokusat nadalej a toto pravo nam vziat.",0,0,10766779,deepBA,deepBA,,1.201452,2017-01-11T04:09:49.994417+00:00
3092293999,65580300,2017-01-10T13:56:03+00:00,"Kdyby se na to dali utáhnout nějací dutohlaví voliči, tak proč ne?",0,0,123641341,ZocelenyDrapalik,zocelenydrapalik,,1.7396429999999998,2017-01-11T04:09:49.994417+00:00
3092291114,65580300,2017-01-10T13:53:50+00:00,Myslíte třeba tank? Protože téměř na všechny ostatní to má již dnes.,0,1,123641341,ZocelenyDrapalik,zocelenydrapalik,,1.7396429999999998,2017-01-11T04:09:49.994417+00:00
3092290109,65580300,2017-01-10T13:53:05+00:00,"Oproti EU, snad vaše mentální schopnosti dostačují alespoň na pochopení toho, co vlastně EU přijala. Seznamte se s tím. Protože dosud jste to evidentné neudělal. Jako ostatně desítky dalších, kteří sice netuší co EU přijala, ale vědí, že to je určitě špatně.",1,1,123641341,ZocelenyDrapalik,zocelenydrapalik,,1.7396429999999998,2017-01-11T04:09:49.994417+00:00
3092284481,65580300,2017-01-10T13:48:35+00:00,"Hezká snaha. Testosteronoví alfasamci vždy budou toužit po zbrani, protože jim dodává pocit moci a síly. To pan Chovanec ví, zejména proto, že je jeden z nich. A letos budou volby. To je celé. 

EU nikoho neodzbrojuje. Opět jen obviklá snaha získat popularitu na úćet EU.  I ten přijatý zákon zakazuje jen zbraně automatické s velkým zásobníkem, které, přiznejme si, jsou potřeba pouze na hromadné vystřílení občanstva v okolí, nikoliv na vlastní obranu. Dokonce se do toho zákona vejde i legální Kalašnikov, takže fakt nechápu, o jakém odzbrojení je řeč. Ale jak jsem řekl. Budou volby a to je celé.",0,1,123641341,ZocelenyDrapalik,zocelenydrapalik,,1.7396429999999998,2017-01-11T04:09:49.994417+00:00
3092262189,65580300,2017-01-10T13:29:59+00:00,"Pěknej žvást. V Izraeli je méně zbraní na osobu než v ČR.  Což je hezký fakt, který nejlépe ilustruje tu obludnost se kterou v nadějj na získání hlasu dutohlavů ministr Chovanec přichází a odsuzuje váš příspěvek do kategorie opileckých výkřiků ve 4. cenové 5 minut před zavíračkou.. ",0,0,123641341,ZocelenyDrapalik,zocelenydrapalik,,1.7396429999999998,2017-01-11T04:09:49.994417+00:00
